<?xml version="1.1" encoding="UTF-8" standalone="no"?>
<!-- Generated by VS code -->
<!DOCTYPE Orders SYSTEM "webOrder.dtd">
<Orders>
    <Order>
        <OrderInformation OrderID="ID_812466666" />
        <ConsigneeInformation>
            <Consignee>
                Lviat Yi
            </Consignee>
            <Address>
                QinYuan34,Nuist
            </Address>
            <FixedPhone>
                4008-823-823
            </FixedPhone>
            <MobilePhone>
                158********
            </MobilePhone>
            <Email>
                LviatYi@foxmail.com
            </Email>
        </ConsigneeInformation>
        <PayAndDelivery PayMethod="在线支付" />
        <BillInformation BillType="增值税发票">
            <BillTitle>Lviat 互动</BillTitle>
            <BillContent>null</BillContent>
        </BillInformation>
        <ProductList>
            <Product>
                <ProductID>963866c9cb5208a7d4b270c05582b686</ProductID>
                <ProductName>直升航母</ProductName>
                <ProductPrice>72,623,000,000</ProductPrice>
                <ProductNumber>3</ProductNumber>
            </Product>
        </ProductList>
        <PaymentInformation>
            <ProductAmount>72,623,000,000</ProductAmount>
            <Freight>670,000</Freight>
            <Cashback>0</Cashback>
            <OrderAmount>72,623,670,000</OrderAmount>
        </PaymentInformation>
    </Order>
</Orders>